{
  "schemaVersion": "1.0.0",
  "datasetVersion": "m0-2025-v1",
  "thresholdPeople": 50000,
  "referenceYear": 2025,
  "coverage": "sample",
  "cities": [
    {
      "id": "un-wup2025:5590",
      "sourceRecordId": "5590",
      "nameEn": "Jakarta",
      "localNames": [],
      "countryOrArea": {
        "code": "IDN",
        "name": "Indonesia",
        "codeSystem": "ISO-3166-1-alpha-3"
      },
      "longitude": 106.824820671592,
      "latitude": -6.32754415510498,
      "coordinateSourceId": "un-wup2025-f21",
      "coordinateMethod": "publisher population-weighted centroid",
      "population": 41913860,
      "referenceYear": 2025,
      "valueStatus": "estimate",
      "definitionId": "un-wup2025-degurba-city",
      "populationSourceId": "un-wup2025-f21"
    },
    {
      "id": "un-wup2025:5991",
      "sourceRecordId": "5991",
      "nameEn": "Bandung",
      "localNames": [],
      "countryOrArea": {
        "code": "IDN",
        "name": "Indonesia",
        "codeSystem": "ISO-3166-1-alpha-3"
      },
      "longitude": 107.628187870505,
      "latitude": -6.92331894949182,
      "coordinateSourceId": "un-wup2025-f21",
      "coordinateMethod": "publisher population-weighted centroid",
      "population": 8909104,
      "referenceYear": 2025,
      "valueStatus": "estimate",
      "definitionId": "un-wup2025-degurba-city",
      "populationSourceId": "un-wup2025-f21"
    },
    {
      "id": "un-wup2025:6249",
      "sourceRecordId": "6249",
      "nameEn": "Dhaka",
      "localNames": [],
      "countryOrArea": {
        "code": "BGD",
        "name": "Bangladesh",
        "codeSystem": "ISO-3166-1-alpha-3"
      },
      "longitude": 90.5792067049057,
      "latitude": 23.7517339465729,
      "coordinateSourceId": "un-wup2025-f21",
      "coordinateMethod": "publisher population-weighted centroid",
      "population": 36585479,
      "referenceYear": 2025,
      "valueStatus": "estimate",
      "definitionId": "un-wup2025-degurba-city",
      "populationSourceId": "un-wup2025-f21"
    },
    {
      "id": "un-wup2025:7537",
      "sourceRecordId": "7537",
      "nameEn": "Chattogram",
      "localNames": [],
      "countryOrArea": {
        "code": "BGD",
        "name": "Bangladesh",
        "codeSystem": "ISO-3166-1-alpha-3"
      },
      "longitude": 91.8103998549196,
      "latitude": 22.3728677361523,
      "coordinateSourceId": "un-wup2025-f21",
      "coordinateMethod": "publisher population-weighted centroid",
      "population": 4983553,
      "referenceYear": 2025,
      "valueStatus": "estimate",
      "definitionId": "un-wup2025-degurba-city",
      "populationSourceId": "un-wup2025-f21"
    },
    {
      "id": "un-wup2025:6030",
      "sourceRecordId": "6030",
      "nameEn": "Tōkyō (Tokyo)",
      "localNames": [],
      "countryOrArea": {
        "code": "JPN",
        "name": "Japan",
        "codeSystem": "ISO-3166-1-alpha-3"
      },
      "longitude": 139.655776246888,
      "latitude": 35.6661787766663,
      "coordinateSourceId": "un-wup2025-f21",
      "coordinateMethod": "publisher population-weighted centroid",
      "population": 33412512,
      "referenceYear": 2025,
      "valueStatus": "estimate",
      "definitionId": "un-wup2025-degurba-city",
      "populationSourceId": "un-wup2025-f21"
    },
    {
      "id": "un-wup2025:4490",
      "sourceRecordId": "4490",
      "nameEn": "Osaka",
      "localNames": [],
      "countryOrArea": {
        "code": "JPN",
        "name": "Japan",
        "codeSystem": "ISO-3166-1-alpha-3"
      },
      "longitude": 135.479603274489,
      "latitude": 34.7225105202779,
      "coordinateSourceId": "un-wup2025-f21",
      "coordinateMethod": "publisher population-weighted centroid",
      "population": 12964145,
      "referenceYear": 2025,
      "valueStatus": "estimate",
      "definitionId": "un-wup2025-degurba-city",
      "populationSourceId": "un-wup2025-f21"
    },
    {
      "id": "un-wup2025:8364",
      "sourceRecordId": "8364",
      "nameEn": "New Delhi",
      "localNames": [],
      "countryOrArea": {
        "code": "IND",
        "name": "India",
        "codeSystem": "ISO-3166-1-alpha-3"
      },
      "longitude": 77.2078130770808,
      "latitude": 28.6257327699734,
      "coordinateSourceId": "un-wup2025-f21",
      "coordinateMethod": "publisher population-weighted centroid",
      "population": 30222405,
      "referenceYear": 2025,
      "valueStatus": "estimate",
      "definitionId": "un-wup2025-degurba-city",
      "populationSourceId": "un-wup2025-f21"
    },
    {
      "id": "un-wup2025:11821",
      "sourceRecordId": "11821",
      "nameEn": "Kolkata",
      "localNames": [],
      "countryOrArea": {
        "code": "IND",
        "name": "India",
        "codeSystem": "ISO-3166-1-alpha-3"
      },
      "longitude": 88.3536574635294,
      "latitude": 22.5859710859864,
      "coordinateSourceId": "un-wup2025-f21",
      "coordinateMethod": "publisher population-weighted centroid",
      "population": 22549738,
      "referenceYear": 2025,
      "valueStatus": "estimate",
      "definitionId": "un-wup2025-degurba-city",
      "populationSourceId": "un-wup2025-f21"
    },
    {
      "id": "un-wup2025:11738",
      "sourceRecordId": "11738",
      "nameEn": "Shanghai",
      "localNames": [],
      "countryOrArea": {
        "code": "CHN",
        "name": "China",
        "codeSystem": "ISO-3166-1-alpha-3"
      },
      "longitude": 121.436920949501,
      "latitude": 31.2147761687116,
      "coordinateSourceId": "un-wup2025-f21",
      "coordinateMethod": "publisher population-weighted centroid",
      "population": 29558908,
      "referenceYear": 2025,
      "valueStatus": "estimate",
      "definitionId": "un-wup2025-degurba-city",
      "populationSourceId": "un-wup2025-f21"
    },
    {
      "id": "un-wup2025:11306",
      "sourceRecordId": "11306",
      "nameEn": "Guangzhou",
      "localNames": [],
      "countryOrArea": {
        "code": "CHN",
        "name": "China",
        "codeSystem": "ISO-3166-1-alpha-3"
      },
      "longitude": 113.285893378223,
      "latitude": 23.142319499894,
      "coordinateSourceId": "un-wup2025-f21",
      "coordinateMethod": "publisher population-weighted centroid",
      "population": 27563372,
      "referenceYear": 2025,
      "valueStatus": "estimate",
      "definitionId": "un-wup2025-degurba-city",
      "populationSourceId": "un-wup2025-f21"
    },
    {
      "id": "un-wup2025:4435",
      "sourceRecordId": "4435",
      "nameEn": "Al-Qahirah (Cairo)",
      "localNames": [],
      "countryOrArea": {
        "code": "EGY",
        "name": "Egypt",
        "codeSystem": "ISO-3166-1-alpha-3"
      },
      "longitude": 31.2607144569505,
      "latitude": 30.0646095252452,
      "coordinateSourceId": "un-wup2025-f21",
      "coordinateMethod": "publisher population-weighted centroid",
      "population": 25566102,
      "referenceYear": 2025,
      "valueStatus": "estimate",
      "definitionId": "un-wup2025-degurba-city",
      "populationSourceId": "un-wup2025-f21"
    },
    {
      "id": "un-wup2025:275",
      "sourceRecordId": "275",
      "nameEn": "Alexandria",
      "localNames": [],
      "countryOrArea": {
        "code": "EGY",
        "name": "Egypt",
        "codeSystem": "ISO-3166-1-alpha-3"
      },
      "longitude": 29.9517660943627,
      "latitude": 31.1933695758061,
      "coordinateSourceId": "un-wup2025-f21",
      "coordinateMethod": "publisher population-weighted centroid",
      "population": 7266957,
      "referenceYear": 2025,
      "valueStatus": "estimate",
      "definitionId": "un-wup2025-degurba-city",
      "populationSourceId": "un-wup2025-f21"
    },
    {
      "id": "un-wup2025:1265",
      "sourceRecordId": "1265",
      "nameEn": "Lagos",
      "localNames": [],
      "countryOrArea": {
        "code": "NGA",
        "name": "Nigeria",
        "codeSystem": "ISO-3166-1-alpha-3"
      },
      "longitude": 3.31028078517139,
      "latitude": 6.56844874683968,
      "coordinateSourceId": "un-wup2025-f21",
      "coordinateMethod": "publisher population-weighted centroid",
      "population": 12791699,
      "referenceYear": 2025,
      "valueStatus": "estimate",
      "definitionId": "un-wup2025-degurba-city",
      "populationSourceId": "un-wup2025-f21"
    },
    {
      "id": "un-wup2025:7330",
      "sourceRecordId": "7330",
      "nameEn": "Onitsha",
      "localNames": [],
      "countryOrArea": {
        "code": "NGA",
        "name": "Nigeria",
        "codeSystem": "ISO-3166-1-alpha-3"
      },
      "longitude": 6.82053185724296,
      "latitude": 6.17349813029485,
      "coordinateSourceId": "un-wup2025-f21",
      "coordinateMethod": "publisher population-weighted centroid",
      "population": 5627706,
      "referenceYear": 2025,
      "valueStatus": "estimate",
      "definitionId": "un-wup2025-degurba-city",
      "populationSourceId": "un-wup2025-f21"
    },
    {
      "id": "un-wup2025:3664",
      "sourceRecordId": "3664",
      "nameEn": "Johannesburg",
      "localNames": [],
      "countryOrArea": {
        "code": "ZAF",
        "name": "South Africa",
        "codeSystem": "ISO-3166-1-alpha-3"
      },
      "longitude": 27.8600917239307,
      "latitude": -26.1204492874788,
      "coordinateSourceId": "un-wup2025-f21",
      "coordinateMethod": "publisher population-weighted centroid",
      "population": 7077175,
      "referenceYear": 2025,
      "valueStatus": "estimate",
      "definitionId": "un-wup2025-degurba-city",
      "populationSourceId": "un-wup2025-f21"
    },
    {
      "id": "un-wup2025:413",
      "sourceRecordId": "413",
      "nameEn": "Cape Town",
      "localNames": [],
      "countryOrArea": {
        "code": "ZAF",
        "name": "South Africa",
        "codeSystem": "ISO-3166-1-alpha-3"
      },
      "longitude": 18.5999587421507,
      "latitude": -33.9805360922243,
      "coordinateSourceId": "un-wup2025-f21",